id,title,link,published,source,category
d60987088345c0c7f1fdb30e40b476c1276f516e062e44ce7c56350a31b86be3,ICC Women’s World Cup: How South Africa stormed into their first-ever World Cup final,https://timesofindia.indiatimes.com/sports/cricket/icc-womens-world-cup-2025/icc-womens-world-cup-how-south-africa-stormed-into-their-first-ever-world-cup-final/articleshow/125012224.cms,2025-11-01T13:25:22+05:30,TOI,Sports
adde1a6d62847ad049d1210c25cf311a12fb00048fd275880ea11c6d34ad464a,From perfect scoop to flawless cover drive: How Jemimah’s hockey roots shaped her batting,https://timesofindia.indiatimes.com/sports/cricket/icc-womens-world-cup-2025/from-perfect-scoop-to-flawless-cover-drive-how-jemimah-rodrigues-hockey-roots-shaped-her-fearless-batting/articleshow/125009117.cms,2025-11-01T09:01:18+05:30,TOI,Sports
867a318aa78b733c4aaba50f2630419297cf3c94ae8981590e849f01bcdf47cc,8th Pay Commission: How is hike in pension amount calculated? Check details,https://timesofindia.indiatimes.com/business/india-business/8th-pay-commission-how-is-hike-in-pension-amount-calculated-check-details/articleshow/125016354.cms,2025-11-01T18:26:09+05:30,TOI,Business
a588d6771982fb29bf4868641e254bd5cd82b7349b3cd8046f293502d4d67dd3,Coal output trend: Coal India production drops 9.8% in October; offtake weak amid post-monsoon slowdown,https://timesofindia.indiatimes.com/business/india-business/coal-output-trend-coal-india-production-drops-9-8-in-october-offtake-weak-amid-post-monsoon-slowdown/articleshow/125016578.cms,2025-11-01T18:14:55+05:30,TOI,Business
a5dae7982efda552081e828a3d8deb273e5a030ebc482ffb2da02f986f839f14,"Currency update: Rs 2,000 notes worth Rs 5,817 crore still in circulation; RBI says 98.37% of high-value bills returned",https://timesofindia.indiatimes.com/business/india-business/currency-update-rs-2000-notes-worth-rs-5817-crore-still-in-circulation-rbi-says-98-37-of-high-value-bills-returned/articleshow/125015931.cms,2025-11-01T17:37:38+05:30,TOI,Business
0fee9006a78b0c0236902dbc9c5d7e1124a3d4c23a976222f60fc8301d101609,Energy demand trends: Power consumption dips 6% to 132 billion units in October; unseasonal rains and cooler weather curb usage,https://timesofindia.indiatimes.com/business/india-business/energy-demand-trends-power-consumption-dips-6-to-132-billion-units-in-october-unseasonal-rains-and-cooler-weather-curb-usage/articleshow/125014693.cms,2025-11-01T16:22:52+05:30,TOI,Business
67772396003e8b8ac818ee45f065d7206d35715ce29d75dcc3d993997b8ef984,GST revenue momentum: Collections rise 4.6% to Rs 1.96 lakh crore in October; festive demand offsets impact of rate cuts,https://timesofindia.indiatimes.com/business/india-business/gst-revenue-momentum-collections-rise-4-6-to-rs-1-96-lakh-crore-in-october-festive-demand-offsets-impact-of-rate-cuts/articleshow/125013763.cms,2025-11-01T15:22:14+05:30,TOI,Business
4b4750ed242fd115fac8ca3a24fb753f456d7738c6ec6fbc415ebb7baabd291f,Small business owners alert! Secure your GST registration in just 3 days; check details,https://timesofindia.indiatimes.com/business/india-business/small-business-owners-alert-secure-your-gst-registration-in-just-3-days-check-details/articleshow/125013665.cms,2025-11-01T15:13:56+05:30,TOI,Business
bdda6f75633034e2b67af96b69a32a871333ce302bbe944f847fde8ba8796aba,US-China trade ties: Trump says talks with Xi ended with ‘great success’ — But will it revive their economies?,https://timesofindia.indiatimes.com/business/international-business/us-china-trade-ties-trump-says-talks-with-xi-ended-with-great-success-but-will-it-revive-their-economies/articleshow/125013187.cms,2025-11-01T14:40:31+05:30,TOI,Business
3f4a69a05828b47b4e20e517cc777bceebb720ec1e818c7c8390b7858cd2178c,Attention FASTag users! NHAI rolls out new rules for KYV process; here’s what has changed,https://timesofindia.indiatimes.com/business/india-business/attention-fastag-users-nhai-rolls-out-new-rules-for-kyv-process-heres-what-has-changed/articleshow/125012008.cms,2025-11-01T13:25:08+05:30,TOI,Business
98b39b20596529763248de5d4e8cbc4073cf2644e0b8e2525185431e10578bdb,‘Alerted everyone’: US treasury secy Scott Bessent slams China over rare earth controls; calls it a ‘real mistake',https://timesofindia.indiatimes.com/business/international-business/alerted-everyone-us-treasury-secy-scott-bessent-slams-china-over-rare-earth-controls-calls-it-a-real-mistake/articleshow/125011976.cms,2025-11-01T13:00:18+05:30,TOI,Business
7a9608a6ff0c26f5bc18a61c0bffd0d1db2e42711cf6efc5b5941c7c7a93d9e8,Tariff row: GTRI's 3-step plan for India to protect its interests; key remarks on Russian oil,https://timesofindia.indiatimes.com/business/india-business/tariff-row-gtris-3-step-plan-for-india-to-protect-its-interests-key-remarks-on-russian-oil/articleshow/125010357.cms,2025-11-01T12:06:44+05:30,TOI,Business
abccb2ad8645e970210c693ec3fdf822683dd550ecb8e662163629db7acd4e2d,"'Supply chain reliability': Not Ukraine, Russia is now top sunflower oil supplier to India; how it happened",https://timesofindia.indiatimes.com/business/india-business/supply-chain-reliability-not-ukraine-russia-is-now-top-sunflower-oil-supplier-to-india-how-it-happened/articleshow/125010307.cms,2025-11-01T11:21:11+05:30,TOI,Business
cbd0ffb2ad1bfff62290148bc12a3d454578ea8b2699d2e0d39c1cfdc5c1c677,31 days and counting: Over $7 billion wiped out; how US govt shutdown is hitting the American economy,https://timesofindia.indiatimes.com/business/international-business/31-days-and-counting-over-7-billion-wiped-out-how-us-govt-shutdown-is-hitting-the-american-economy/articleshow/125009699.cms,2025-11-01T10:10:14+05:30,TOI,Business
c1699762d615e16e7a108ec7cb1a6fdb75971e7df667c0c4f5c04336742813e1,Trump on 60 Minutes: US president returns for a CBS interview after $16 million settlement; all you need to know about the feud,https://timesofindia.indiatimes.com/business/international-business/trump-on-60-minutes-us-president-returns-for-a-cbs-interview-after-16-million-settlement-all-you-need-to-know-about-the-feud/articleshow/125008721.cms,2025-11-01T08:11:40+05:30,TOI,Business
136f63bbeed2e123d426ec5ad0815ac4fa88909d155f39bb17bd6442017195ad,"Ford to invest Rs 3,250 crore to make new-gen engines",https://timesofindia.indiatimes.com/business/international-business/ford-to-invest-rs-3250-crore-to-make-new-gen-engines/articleshow/125008366.cms,2025-11-01T07:15:16+05:30,TOI,Business
d3b3d0b2e0464ec7adfb301f78630ed5ce4f80a3d78e0683c56aebda342beb92,Sebi probes MCX’s over 4-hour trading disruption on October 28,https://timesofindia.indiatimes.com/business/india-business/sebi-probes-mcxs-over-4-hour-trading-disruption-on-october-28/articleshow/125008327.cms,2025-11-01T07:09:53+05:30,TOI,Business
76fb1cbf6953e8ca7e12a4a9cd30d2514a327aa7819e92e218aa8f3273281e64,Honda eyes comeback with revamped car fleet,https://timesofindia.indiatimes.com/business/international-business/honda-eyes-comeback-with-revamped-car-fleet/articleshow/125008348.cms,2025-11-01T07:14:14+05:30,TOI,Business
f35e7046780ae1b4f68514b5ac53333040568dad0643f34a4e03566197cbb70c,Make greater use of domestic funds to power startup ecosystem growth: Piyush Goyal,https://timesofindia.indiatimes.com/business/india-business/make-greater-use-of-domestic-funds-to-power-startup-ecosystem-growth-piyush-goyal/articleshow/125008284.cms,2025-11-01T07:01:39+05:30,TOI,Business
71ad3f3eaabbdf59a9290baa4d8050fbb27e24c205b313233af9f0906fda002b,"Maruti Suzuki Q2 net up 8% at Rs 3,349 crore",https://timesofindia.indiatimes.com/business/india-business/maruti-suzuki-q2-net-up-8-at-rs-3349-crore/articleshow/125008371.cms,2025-11-01T07:15:51+05:30,TOI,Business
029b31a15ad1f71a9183477295a7b24476184c24a9f8b3f5236a455fd291d125,Orkla India IPO subscribed nearly 49 times,https://timesofindia.indiatimes.com/business/india-business/orkla-india-ipo-subscribed-nearly-49-times/articleshow/125008430.cms,2025-11-01T07:24:32+05:30,TOI,Business
0509cae670052337a1cc4c7b76f6d29036bb632f89492337bc767f08488c6f9a,India's forex reserves down $7 billion to $695.4 billion,https://timesofindia.indiatimes.com/business/india-business/indias-forex-reserves-down-7-billion-to-695-4-billion/articleshow/125008377.cms,2025-11-01T07:16:30+05:30,TOI,Business
1ef4c0ace5d47f95a006d07298bb2ce0773f21462cd083f4219597cee8c17c37,Coal revival drive: ECL reopens two closed mines under MDO model; aims to cut losses and lift output,https://timesofindia.indiatimes.com/business/india-business/coal-revival-drive-ecl-reopens-two-closed-mines-under-mdo-model-aims-to-cut-losses-and-lift-output/articleshow/125017146.cms,2025-11-01T18:51:19+05:30,TOI,Business
cfdc53e1ff6a78fc9aeac28b81ce8a3cdb91677d724f5644f7285fe0bff0640a,India and SA prepare for game-changing World Cup final,https://www.bbc.com/sport/cricket/articles/c051116l4j9o?at_medium=RSS&at_campaign=rss,"Sat, 01 Nov 2025 13:47:29 GMT",BBC,Sports
b750db47e772f1efa1de208fca43aa0a5f31294e87255d14634425ec7827f5a3,Andhra temple stampede: Probe ordered as rush kills 9 devotees - top developments,https://timesofindia.indiatimes.com/india/andhra-temple-stampede-inquiry-ordered-as-rush-kills-9-devotees-top-developments/articleshow/125015807.cms,"Sat, 01 Nov 2025 17:44:13 +0530",TOI,Top Stories
4f3b173d6d4bc032f92d381a9e9b9512cbe6bdfd7235c95d10db8805beb514f2,Bihar polls: EC acts against officials in Mokama murder; advises to transfer top cop,https://timesofindia.indiatimes.com/india/bihar-polls-ec-takes-action-against-officials-after-jan-suraaj-leaders-murder-in-mokama-recommends-transfer-of-top-cop/articleshow/125017760.cms,"Sat, 01 Nov 2025 19:31:32 +0530",TOI,Top Stories
6c6b6232a80d351eefa0bb958847bb24724f93ff9107ede56d0f549a238ede9a,$500m scam: Indian telecom player Bankim Brahmbhatt accused of duping BlackRock; now on the run,https://timesofindia.indiatimes.com/business/india-business/indian-telecom-player-bankim-brahmbhatt-bunks-us-after-500-rip-off/articleshow/125017555.cms,"Sat, 01 Nov 2025 19:18:21 +0530",TOI,Top Stories
afc431f7d85a38f648a63ed99ba80626229d8853ea076996aade087940085855,Bihar polls: Opinion poll predicts close victory for NDA; Tejashwi most preferred CM face,https://timesofindia.indiatimes.com/india/bihar-polls-opinion-poll-predicts-close-victory-for-nda-tejashwi-yadav-most-preferred-cm-face/articleshow/125016709.cms,"Sat, 01 Nov 2025 18:24:23 +0530",TOI,Top Stories
4618ff5f0673559d3b852b203d7c537d059f42cf4fc90582b40add40b23daf91,Trapped by duties: India’s workforce and toxic jobs; why quitting isn’t an option,https://timesofindia.indiatimes.com/education/careers/news/i-have-to-survive-three-more-years-why-responsibilities-trap-indias-workforce-in-toxic-jobs-they-cant-leave/articleshow/125017558.cms,"Sat, 01 Nov 2025 19:17:13 +0530",TOI,Top Stories
4c2058b2193c67214807bad86b6adc3de0cc3448e40b4ff99623c948f3b908cb,Bill Gates doubted OpenAI investment: 'Burn a billion'; Microsoft spent $13B,https://timesofindia.indiatimes.com/technology/tech-news/microsoft-ceo-satya-nadella-remembers-bill-gates-warned-him-on-openai-giving-1-billion-to-them-is-like-/articleshow/124891759.cms,"Wed, 29 Oct 2025 12:10:55 +0530",TOI,Top Stories
dc6aae5f397df67d9db0b1f4374a415208f2e4f36ae3e04a3edfcdf52141ad8f,Is Giannis Antetokounmpo playing tonight? Bucks star’s injury status vs Kings,https://timesofindia.indiatimes.com/sports/nba/top-stories/is-giannis-antetokounmpo-playing-tonight-milwaukee-bucks-stars-injury-update-and-status-against-sacramento-kings-game-revealed-11-01-2015/articleshow/125016512.cms,"Sat, 01 Nov 2025 18:14:52 +0530",TOI,Top Stories
d40417187894a6afcc55f140c4f9d42ec35644b302d69c072857c76174088d91,How much farting is normal per day? Top nutrition coach reveals 'healthy' number,https://timesofindia.indiatimes.com/life-style/health-fitness/how-much-farting-is-normal-per-day-top-nutrition-coach-reveals-the-healthy-number/articleshow/124982291.cms,"Fri, 31 Oct 2025 09:03:45 +0530",TOI,Top Stories
19f060bad4811969b9165aef06b25e16d1a1d78edd28d3f5cdc3b3504713aec8,Jalen Hurts sparks mystery with cryptic ‘God’ costume at Eagles party,https://timesofindia.indiatimes.com/sports/nfl/news/jalen-hurts-sparks-mystery-at-philadelphia-eagles-halloween-party-with-cryptic-god-costume/articleshow/125013668.cms,"Sat, 01 Nov 2025 16:11:12 +0530",TOI,Top Stories
9745333349e6e02c0a8fff9db64906bbce7822d599ef1922adfc375e0f759375,UAE health authorities urge residents aged 50+ to take shingles vaccine for protection,https://timesofindia.indiatimes.com/world/middle-east/uae-health-authorities-urge-residents-aged-50-to-take-shingles-vaccine-for-protection/articleshow/125017520.cms,2025-11-01T19:23:08+05:30,TOI,World
28995eff547ecbfc33d107604073a184ed3817fba9e8981385cbab7dfae0694b,Woman charged over Louvre jewellery heist,https://www.bbc.com/news/articles/cvgkk1mkg0po?at_medium=RSS&at_campaign=rss,"Sat, 01 Nov 2025 15:52:56 GMT",BBC,World
bf99f5e3e7e02bbb7c8f69c648269ea1602cdb4205b24058b8b25d011312bf93,McKibbin remains in front in Hong Kong after third round,https://www.bbc.com/sport/golf/articles/cvgvvved43zo?at_medium=RSS&at_campaign=rss,"Sat, 01 Nov 2025 14:22:13 GMT",BBC,Sports
3711489cea4cb1e759fb8709a36317b8184971437dc69c7781f90c5f57365348,Louvre heist: 30-year-old woman charged with criminal conspiracy in Paris museum theft,https://timesofindia.indiatimes.com/world/europe/louvre-heist-30-year-old-woman-charged-in-paris-museum-theft-report-says/articleshow/125018122.cms,"Sat, 01 Nov 2025 19:56:19 +0530",TOI,Top Stories
c102a53487eddf819488ad5f6da6ccff23225b04f205c7b7eed7aabb189c71fe,Mokama murder: EC orders replacement of two officials; seeks action compliance report,https://timesofindia.indiatimes.com/india/bihar-political-killing-ec-orders-replacement-of-two-officials-seeks-action-compliance-report/articleshow/125018184.cms,"Sat, 01 Nov 2025 20:05:11 +0530",TOI,Top Stories
4bf6a3558716f735ce325dc8afa6e13f989953004c7b6a594e41776e9102e1bf,Amazon founder Jeff Bezos on why he thinks stress is a warning that he hasn’t faced something important,https://timesofindia.indiatimes.com/technology/tech-news/amazon-founder-jeff-bezos-on-why-he-thinks-stress-is-a-warning-for-him-that-he-has-not-/articleshow/125013738.cms,"Sat, 01 Nov 2025 15:16:57 +0530",TOI,Top Stories
37f21c111e2ccafc87baca92df650d0ec5f647097e48ea05172a51ed1aefcfb1,52% of Gen Z decline being bosses: Leadership evolves; skills drive growth,https://timesofindia.indiatimes.com/education/careers/news/52-percent-of-gen-z-say-no-to-becoming-managers-why-young-professionals-arent-chasing-the-boss-title-anymore/articleshow/125016464.cms,"Sat, 01 Nov 2025 18:11:41 +0530",TOI,Top Stories
4cd5603cc2ecafa6dd0f4c04d3d7c003ab32acaf484bee21ff364fc0a0494a58,Former India U-19 cricketer Rajesh Banik dies in accident; Tripura cricket mourns,https://timesofindia.indiatimes.com/sports/cricket/news/tragic-ex-india-u-19-world-cup-and-ranji-trophy-cricketer-passes-away-in-road-mishap/articleshow/125018259.cms,"Sat, 01 Nov 2025 20:19:30 +0530",TOI,Top Stories
24332a7ec06c1b7f0371080f91b43468575600fddc9df7368ca8b0acd783a3aa,"Nvidia CEO Jensen Huang on selling AI chips to China, says access to Chinese market ‘in America’s best interest’",https://timesofindia.indiatimes.com/technology/tech-news/nvidia-ceo-jensen-huang-on-selling-ai-chips-to-china-its-in-the-best-interest-of-america-to-/articleshow/125017768.cms,"Sat, 01 Nov 2025 19:28:27 +0530",TOI,Top Stories
d285ce9ee0940f6622e303dd90eaec5121e371866bd114f51d83a95c025d4ae6,Caitlin Clark vs Paige Bueckers: Net worth and salary contract breakdown,https://timesofindia.indiatimes.com/sports/nba/top-stories/caitlin-clark-vs-paige-bueckers-net-worth-salary-comparison-contract-details-and-more/articleshow/125016327.cms,"Sat, 01 Nov 2025 18:01:19 +0530",TOI,Top Stories
9565981e20ef7c35e543074e6ae26edc7e29ff1e5ce78abe783294f9e999f2ac,COP30 snub: US to skip top-level presence in Brazil,https://timesofindia.indiatimes.com/world/us/cop30-snub-us-to-skip-top-level-presence-in-brazil-donald-trump-directly-engaging-with-leaders-on-energy-issues/articleshow/125017542.cms,2025-11-01T21:02:25+05:30,TOI,World
9c66cdf1a5c05d90f9343cc4a7ac7afaf07bba449593f72d517335cbbe9bc85c,Who receives SNAP? Data reveals who’s most at risk as 42 million Americans lose food aid under Trump administration,https://timesofindia.indiatimes.com/world/us/who-receives-snap-data-reveals-whos-most-at-risk-as-42-million-lose-food-aid-under-trump-administration/articleshow/125018539.cms,2025-11-01T21:00:24+05:30,TOI,World
9270d8f6a78f7e3596e82d82f6b02020b9a2410dc101de560f2b409802a8d813,Dubai Metro to start at 3am on Sunday as Sheikh Zayed Road closes for Dubai Ride 2025,https://timesofindia.indiatimes.com/world/middle-east/dubai-metro-to-start-at-3am-on-sunday-as-sheikh-zayed-road-closes-for-dubai-ride-2025/articleshow/125018354.cms,2025-11-01T20:18:52+05:30,TOI,World
e533d7677e263a44e957984fe004dc4dc2ad0a89f2703123b191ff9d8065e9e9,Watch: Elon Musk explains why Donald Trump is ‘not evil',https://timesofindia.indiatimes.com/world/us/watch-elon-musk-explains-why-donald-trump-is-not-evil/articleshow/125017066.cms,2025-11-01T19:41:03+05:30,TOI,World
4cd5603cc2ecafa6dd0f4c04d3d7c003ab32acaf484bee21ff364fc0a0494a58,Tragic! Ex-IND U-19 WC & Ranji Trophy cricketer passes away in road mishap,https://timesofindia.indiatimes.com/sports/cricket/news/tragic-ex-india-u-19-world-cup-and-ranji-trophy-cricketer-passes-away-in-road-mishap/articleshow/125018259.cms,2025-11-01T20:19:30+05:30,TOI,Sports
b04156663cd15cd883869cbb15b23ef36b244cad2f4efe8d941354c2129b2f67,Karun Nair slams ton vs Kerala in Ranji; continues blistering run after India A snub,https://timesofindia.indiatimes.com/sports/cricket/news/karun-nair-slams-century-against-kerala-in-ranji-trophy-continues-blistering-run-after-india-a-snub/articleshow/125019102.cms,2025-11-01T21:19:56+05:30,TOI,Sports
cb0708c369c4749365187b1509a401539d946a9df96ba888d016175b6f52357a,Rishabh Pant's counterattack keeps India 'A' alive in chase of 275 vs South Africa 'A',https://timesofindia.indiatimes.com/sports/cricket/news/rishabh-pants-counterattack-keeps-india-a-alive-in-chase-of-275-vs-south-africa-a/articleshow/125018107.cms,2025-11-01T19:53:39+05:30,TOI,Sports
aa19c5e8cc7a6b34e381c6321b81fcac3cdc7e1f2a37076c19e8ba00f6817e74,'Worst AUS team since 2010': Steve Smith responds to Broad's Ashes banter,https://timesofindia.indiatimes.com/sports/cricket/news/obviously-worst-australian-team-since-2010-steve-smith-responds-bluntly-to-stuart-broads-banter-ahead-of-ashes/articleshow/125017536.cms,2025-11-01T19:32:56+05:30,TOI,Sports
dd51e320983449622f28bf2fdafc74a7f84fd8c91f9ddf6c1809ad0f4c988262,Berkshire Hathaway Q3 results: Profit jumps 17% to $30.8 bn as Buffett readies exit; Greg Abel set to take charge amid $381 bn cash pile,https://timesofindia.indiatimes.com/business/international-business/berkshire-hathaway-q3-results-profit-jumps-17-to-30-8-bn-as-buffett-readies-exit-greg-abel-set-to-take-charge-amid-381-bn-cash-pile/articleshow/125018421.cms,2025-11-01T20:13:49+05:30,TOI,Business
c3fc4aac0ba59eaccfcc6b1ee7f08d5ff2f3a1c559d04d5898b4dd501b197f7c,Chip export thaw: China exempts some Nexperia products from ban; signals easing with Europe,https://timesofindia.indiatimes.com/business/international-business/chip-export-thaw-china-exempts-some-nexperia-products-from-ban-signals-easing-with-europe/articleshow/125018083.cms,2025-11-01T19:53:35+05:30,TOI,Business
6bda6a29b96289679ab4887990fb84db003b903252992a87b23b3c334d957727,"CM honours Sarasamma teacher, writer M.M. Basheer at Malayalam language day celebration",https://www.thehindu.com/news/national/kerala/cm-honours-sarasamma-teacher-writer-mm-basheer-at-malayalam-language-day-celebration/article70229434.ece,"Sat, 01 Nov 2025 21:37:14 +0530",TheHindu,Top Stories
834fb764539f7882dd9746ae8abf9b55b37032239234f36331bfce482b698a20,Minister heads gram sabha meeting at Aalathur panchayat in Madurai,https://www.thehindu.com/news/cities/Madurai/minister-heads-gram-sabha-meeting-at-aalathur-panchayat-in-madurai/article70229364.ece,"Sat, 01 Nov 2025 21:36:04 +0530",TheHindu,Top Stories
90b1bbd5e0d4aeb0f09e6354a9ad624b2df6f5ad1305cdfd24a1c7630a944c8b,E-pass comes into effect for vehicles entering Valparai,https://www.thehindu.com/news/cities/Coimbatore/e-pass-comes-into-effect-for-vehicles-entering-valparai/article70230102.ece,"Sat, 01 Nov 2025 21:34:37 +0530",TheHindu,Top Stories
4a277b9514994ad34818e804549a51059a068422b47b0e62af70559b48be27a9,Spices Board to cancel auction company’s licence if cardamom grower is not paid in 10 days,https://www.thehindu.com/news/national/kerala/spices-board-to-cancel-auction-companys-licence-if-cardamom-grower-is-not-paid-in-10-days/article70230066.ece,"Sat, 01 Nov 2025 21:34:31 +0530",TheHindu,Top Stories
f0fae03ad1bd56e83b65f38893fa86112a57ec7ef65ec9172879ae7e199478af,"Reach out to distressed farmers, Congress urges Uttar Pradesh CM",https://www.thehindu.com/news/national/uttar-pradesh/reach-out-to-distressed-farmers-congress-urges-uttar-pradesh-cm/article70230226.ece,"Sat, 01 Nov 2025 21:29:06 +0530",TheHindu,Top Stories
c87ba942ea21fedcf5f83ab11d691e1d015925637244734a96738e4fa9660371,"Two-member delegation from Hamamatsu, Japan, visited Coimbatore to strengthen collaboration",https://www.thehindu.com/news/cities/Coimbatore/two-member-delegation-from-hamamatsu-japan-visited-coimbatore-to-strengthen-collaboration/article70230210.ece,"Sat, 01 Nov 2025 21:28:41 +0530",TheHindu,Top Stories
1e01a1da1a1e926aadc366c633d3a603ec35bc80015766c56ae96769bac36823,Lorry driver held for wall collapse near Erode RUB,https://www.thehindu.com/news/cities/Coimbatore/lorry-driver-held-for-wall-collapse-near-erode-rub/article70230390.ece,"Sat, 01 Nov 2025 21:28:19 +0530",TheHindu,Top Stories
dc2ca61f6f12c0aa94a47dd6c9d692e2115a5ff98baf5323ef9936bf59c5203c,BRS and BJP have an adhesive bond: Revanth Reddy,https://www.thehindu.com/news/national/telangana/brs-and-bjp-have-an-adhesive-bond-revanth-reddy/article70230371.ece,"Sat, 01 Nov 2025 21:26:57 +0530",TheHindu,Top Stories
b964a4e96feb17e4de530bcf88c96767d6870771015f49f91d20fb2897701b54,Steps will be taken to vacate the stay and continue the Dharmasthala case investigation: Dinesh,https://www.thehindu.com/news/cities/Mangalore/steps-will-be-take-to-vacate-the-stay-and-continue-the-dharmasthala-case-investigation-dinesh/article70230251.ece,"Sat, 01 Nov 2025 21:25:37 +0530",TheHindu,Top Stories
31befd0a94563dad0f3dcf06507bd43a4e0ccff47d057acd985588d35a57c244,Protest erupts at private college in Visakhapatnam over student’s death,https://www.thehindu.com/news/cities/Visakhapatnam/protest-erupts-at-private-college-in-visakhapatnam-over-students-death/article70230208.ece,"Sat, 01 Nov 2025 21:25:34 +0530",TheHindu,Top Stories
24e5833b63b9e22b2a62b709d7dfc19cb36c53843103d5d4bec565d0b8601759,"We have brought in reforms to help the public, says Karnataka Revenue Minister Krishna Byre Gowda",https://www.thehindu.com/news/national/karnataka/we-have-brought-in-reforms-to-help-the-public-says-karnataka-revenue-minister-krishna-byre-gowda/article70229137.ece,"Sat, 01 Nov 2025 21:24:49 +0530",TheHindu,Top Stories
3fd50ceef94fdf4eba4c9ed3dcaa9a8d98d3775dccbdbe850ad71c2562c624ae,Former spokesperson blames BJP leadership for councillor’s suicide,https://www.thehindu.com/news/national/kerala/former-spokesperson-blames-bjp-leadership-for-councillors-suicide/article70229145.ece,"Sat, 01 Nov 2025 21:23:54 +0530",TheHindu,Top Stories
71885880d6757a05348500ff1868ba7e8564843acc9cc4f3d4dfc3db1d9f5b75,Women’s Cricket World Cup final: Proteas stand between Women in Blue and ultimate glory,https://www.thehindu.com/sport/cricket/womens-cricket-world-cup-final-proteas-stand-between-women-in-blue-and-ultimate-glory/article70230391.ece,"Sat, 01 Nov 2025 21:21:51 +0530",TheHindu,Top Stories
cf717732f5d01b77e755e93bcf4b1eaab4ae757ee28c5a51dacf3c3c2db83f1b,Students to lead climate debate at Makkala Climate Action Sabhe,https://www.thehindu.com/news/national/karnataka/students-to-lead-climate-debate-at-makkala-climate-action-sabhe/article70230000.ece,"Sat, 01 Nov 2025 21:20:27 +0530",TheHindu,Top Stories
c346ed295222267fe3166e06ce78a2a028285733a751689e6b305cacdfbddad8,Foundation for semiconductor production unit laid in Bhubaneswar,https://www.thehindu.com/news/national/odisha/foundation-for-semiconductor-production-unit-laid-in-bhubaneswar/article70229773.ece,"Sat, 01 Nov 2025 21:15:05 +0530",TheHindu,Top Stories
756f017c0ac2fdbc9fbce3252510f12641bf98b8ce21cb25a1e935fca229634a,CM inaugurates Ambasamudram bypass road,https://www.thehindu.com/news/cities/Madurai/cm-inaugurates-ambasamudram-bypass-road/article70230184.ece,"Sat, 01 Nov 2025 21:13:59 +0530",TheHindu,Top Stories
a68316782f4b682a6b10831d852c942ec1c6e7e548b716d130b23a249192f825,"Shirva gram panchayat will be upgraded as a town panchayat, says Laxmi Hebblakar",https://www.thehindu.com/news/cities/Mangalore/shirva-gram-panchayat-will-be-upgraded-as-a-town-panchayat-says-laxmi-hebblakar/article70230167.ece,"Sat, 01 Nov 2025 21:13:02 +0530",TheHindu,Top Stories
9febc64455ba4f1ca2db285decd4edcae9dd6a735e1327b1bfd8ead88096a600,Vishnu Deo Sai: Bastar rising beyond its scars,https://www.thehindu.com/news/national/chhattisgarh/vishnu-deo-sai-bastar-rising-beyond-its-scars/article70229761.ece,"Sat, 01 Nov 2025 21:11:03 +0530",TheHindu,Top Stories
c468c186882c5d047e877a9b68af1cbb4b9b0cbb09429488efc6ca8601bbb17a,"Bihar Assembly polls: CPI(M) issues manifesto, accuses NDA of running a ‘negative campaign’",https://www.thehindu.com/elections/bihar-assembly/bihar-assembly-polls-cpim-issues-manifesto-accuses-nda-of-running-a-negative-campaign/article70230043.ece,"Sat, 01 Nov 2025 21:09:12 +0530",TheHindu,Top Stories
f8290ac3e0e1bde9ecab4cec426337c95f9df78db6c0e417c3f4a4f92ecf0eea,Government reserves 85% PG medical seats for Telangana students,https://www.thehindu.com/news/national/telangana/government-reserves-85-pg-medical-seats-for-telangana-students/article70230279.ece,"Sat, 01 Nov 2025 21:08:56 +0530",TheHindu,Top Stories
