id,title,link,published,source,category
ebb71103ab052efe2261846e2194a23312ae23b2190f29f9a374fa8d59c65915,"'We need food, we have no food' - desperation takes hold in Jamaica after hurricane",https://www.bbc.com/news/articles/c0jdd186l0go?at_medium=RSS&at_campaign=rss,"Sat, 01 Nov 2025 02:10:13 GMT",BBC,World
32beb1890fb872c059808bc79dcb5915ca3848647fb4c2f854377aaf622a0961,"Defence of Donbas town a priority, Zelensky says, as special forces deployed",https://www.bbc.com/news/articles/crklljyx6mzo?at_medium=RSS&at_campaign=rss,"Sat, 01 Nov 2025 12:25:48 GMT",BBC,World
bef8860e1e7825019beefdd3215f4ac9c0e7761309a1bce94a55dc01b5085ec0,Tanzania president wins election as hundreds feared dead in unrest,https://www.bbc.com/news/articles/cm2ww0e0jewo?at_medium=RSS&at_campaign=rss,"Sat, 01 Nov 2025 09:45:38 GMT",BBC,World
cd91fc47e02a16e478fe7fd058f3920a8e8c19a59cd489cfcb29dc4ecaf30ca6,China to loosen chip export ban to Europe after Netherlands row,https://www.bbc.com/news/articles/cly44qwgnx0o?at_medium=RSS&at_campaign=rss,"Sat, 01 Nov 2025 05:31:42 GMT",BBC,World
25e10194ec54cc48f7e7f82322057702a4fa1fa48919d7e0ac1137042ac1ae9b,Police seize €1.3bn from Campari owner over alleged tax evasion,https://www.bbc.com/news/articles/cpq11v5d1rno?at_medium=RSS&at_campaign=rss,"Sat, 01 Nov 2025 11:27:16 GMT",BBC,World
eba557a245f89ea22cf560367c7d88079ca5960e6cf930f28574a5d721564ad4,"More than 60,000 flee Sudanese city after its capture by RSF militia, says UN",https://www.bbc.com/news/articles/c0qppe4vdevo?at_medium=RSS&at_campaign=rss,"Fri, 31 Oct 2025 18:01:15 GMT",BBC,World
7aebe49fdd17452b92b3e689af35635fa1c9727ce52c5e5c60af8365bc2047fd,Dutch centrist Rob Jetten claims victory in neck-and-neck election race,https://www.bbc.com/news/articles/cq6z5e5y55eo?at_medium=RSS&at_campaign=rss,"Fri, 31 Oct 2025 16:48:17 GMT",BBC,World
029636c4796351791630f6e89eb5ee4b5eb966eec1e553a745836403d01164bf,South Africa hits back at US refugee plan to favour white Afrikaners,https://www.bbc.com/news/articles/c1e3de5ny14o?at_medium=RSS&at_campaign=rss,"Fri, 31 Oct 2025 16:45:28 GMT",BBC,World
30440147500dae699ff1b918857eaa63c7380a7349fa3a3761ccafab5d4dbed6,Hotel owner and 10 others jailed for life over deadly Turkish fire,https://www.bbc.com/news/articles/c7977nlzvgpo?at_medium=RSS&at_campaign=rss,"Fri, 31 Oct 2025 21:31:52 GMT",BBC,World
ca26c451402ff8f47645b656ab6dd11f025bf5156d2fa912fb5edcdef157befc,"Tchéky Karyo, star of Nikita and The Missing, dies at 72",https://www.bbc.com/news/articles/cx2dd7yyly9o?at_medium=RSS&at_campaign=rss,"Fri, 31 Oct 2025 21:56:03 GMT",BBC,World
141e78c854b0e37836d757bb0e245f5c4ba00dcb90f055b3825c25ce2c90265f,Latvian vote to pull out of treaty on protecting women from violence prompts outcry,https://www.bbc.com/news/articles/cn09x7jpvw7o?at_medium=RSS&at_campaign=rss,"Fri, 31 Oct 2025 15:57:44 GMT",BBC,World
0ebda0f21f026ae99134cb1986381f55741ad092cb665039901a4d24d193fb7c,France hit by second major heist as thieves target gold refinery,https://www.bbc.com/news/articles/cwykk10053eo?at_medium=RSS&at_campaign=rss,"Fri, 31 Oct 2025 21:32:21 GMT",BBC,World
74c69b671eed70e1ce36e49232f80a74b4487bee760f4d005fe0065dcf18488b,"Canada's Carney to visit Xi in China, marking 'turning point' in relations",https://www.bbc.com/news/articles/cx27pe8ekpdo?at_medium=RSS&at_campaign=rss,"Fri, 31 Oct 2025 17:13:09 GMT",BBC,World
a94592c2023ff136fbfe70ce7323d8631f73c29109d023a98fc0be007a43e6a6,"Sixty years after tourist stole skull from cathedral, he sends it back",https://www.bbc.com/news/articles/c2317drzm04o?at_medium=RSS&at_campaign=rss,"Fri, 31 Oct 2025 11:51:32 GMT",BBC,World
7d0bf7cb3311ddbb5986be1310ce8b776152746902d21c1ba000c3dbcf8e1429,US judges say Trump administration must continue food aid during shutdown,https://www.bbc.com/news/articles/cr433x9zqq4o?at_medium=RSS&at_campaign=rss,"Fri, 31 Oct 2025 20:22:22 GMT",BBC,World
7f4d0dad9cd517e02303b618484c22c18101b0dc0d133208c6677e98cf1020bd,"US strikes on alleged drug boats violate law, UN human rights chief says",https://www.bbc.com/news/articles/cx2nx95pgz7o?at_medium=RSS&at_campaign=rss,"Fri, 31 Oct 2025 13:05:44 GMT",BBC,World
54ab902fe711d501750dff17ac5c8b5e3db190672fe5ad07b3679894ed6db330,Disney pulls channels from YouTube TV over fee dispute,https://www.bbc.com/news/articles/c2emmdx0x38o?at_medium=RSS&at_campaign=rss,"Fri, 31 Oct 2025 16:43:55 GMT",BBC,World
c32c1c585c1b3ffe1ba21a1a561b6035dda6210b17368ef70425011037d665b0,Israel confirms identities of hostages' bodies returned by Hamas,https://www.bbc.com/news/articles/c4gj90j2g8jo?at_medium=RSS&at_campaign=rss,"Fri, 31 Oct 2025 10:14:53 GMT",BBC,World
1ae5d5f24c2f36891d788777a737c30db3f719cf813151ed2c6e4540baecce4b,India-US sign 10-year defence pact amid tariff turmoil,https://www.bbc.com/news/articles/c5y0qz701xeo?at_medium=RSS&at_campaign=rss,"Fri, 31 Oct 2025 08:02:49 GMT",BBC,World
f5d822c524d1283c3cce375ec05a08a97780447e828a890be95311ce2e356926,Barcelona's Sagrada Família becomes world's tallest church,https://www.bbc.com/news/articles/ce9dr45g49yo?at_medium=RSS&at_campaign=rss,"Fri, 31 Oct 2025 02:40:47 GMT",BBC,World
ae8241edd9b98acc909c493d90071c6b421365f8eeceec49e9733d491812b714,Nvidia strikes bumper AI deals with Asia tech giants,https://www.bbc.com/news/articles/cyv862r7l2ro?at_medium=RSS&at_campaign=rss,"Fri, 31 Oct 2025 11:24:46 GMT",BBC,World
cef663318caf08826a6b6b7e0d236dfd8334a22c21193c022177667378700a57,'I was accused of spying and beaten' - a boy's escape from captured Sudan city,https://www.bbc.com/news/articles/clyk1nq6v4lo?at_medium=RSS&at_campaign=rss,"Sat, 01 Nov 2025 01:02:54 GMT",BBC,World
31f68f6539d404eb253424dfab5306627fa99d242fe35bd57644d482d4054a98,Hand of Moscow? The men jailed for vandalism in French hybrid warfare case,https://www.bbc.com/news/articles/c891d43l8pyo?at_medium=RSS&at_campaign=rss,"Sat, 01 Nov 2025 00:36:56 GMT",BBC,World
15b46e12dfa8052cde10c475e33fe5ce41b4c269028e2fcc7717a10bfd8a8bb4,"Egypt's Grand Museum opens, displaying Tutankhamun tomb in full for first time",https://www.bbc.com/news/articles/ckg4q403rpzo?at_medium=RSS&at_campaign=rss,"Sat, 01 Nov 2025 01:19:28 GMT",BBC,World
84b62d3dc77846a6e2a8e0074f85058014fba0caf4bc14fbee90dd020462c0b7,Halloween 2025: All the celebrity costumes at Heidi Klum's party,https://www.bbc.com/news/articles/c4gpwn5v072o?at_medium=RSS&at_campaign=rss,"Sat, 01 Nov 2025 04:58:44 GMT",BBC,World
b0a0c55d832aef9f062b1efcc5e2f2e3b1553d6ce03f5f33a5c9210da66400e8,Why the Indian passport is falling in global ranking,https://www.bbc.com/news/articles/c3ep1epqjkpo?at_medium=RSS&at_campaign=rss,"Sat, 01 Nov 2025 01:10:03 GMT",BBC,World
509b4b6aa499be9ba03fc0c50980613e8b2392e2cededd957267fabef29af15b,The US bet big with Argentina bailout - is it paying off?,https://www.bbc.com/news/articles/c4g3mdvle78o?at_medium=RSS&at_campaign=rss,"Fri, 31 Oct 2025 00:11:41 GMT",BBC,World
38fb80d3477cf6f471431fa8164db0d1ecfaf92f68ba5d2cc809d32dac44fab8,How teenager gave a street concert and was caught up in Russia's repressive past,https://www.bbc.com/news/articles/cz91jyxj88ko?at_medium=RSS&at_campaign=rss,"Fri, 31 Oct 2025 00:19:47 GMT",BBC,World
83047b67db51a2b89ebb576963fa05f2e718dfdd05f034a2b183a6f17a4fc2cb,Russia's new nuclear weapons - real threat or Putin bluster?,https://www.bbc.com/news/articles/cn40w7g2d2zo?at_medium=RSS&at_campaign=rss,"Fri, 31 Oct 2025 08:00:12 GMT",BBC,World
0046effaec8589c23434b1fdffa56e7585c22ddb70d12b04a331e970d89512d9,The American adoptees who fear deportation to a country they can't remember,https://www.bbc.com/news/articles/cwy1n438dk4o?at_medium=RSS&at_campaign=rss,"Fri, 31 Oct 2025 00:33:07 GMT",BBC,World
e573652b4e9d0ab1c5b6206eb4a6fa0b9791a32990f3040a98c8d4794771024c,Watch: Heidi Klum slithers into Halloween as Medusa,https://www.bbc.com/news/videos/c8911dwekdno?at_medium=RSS&at_campaign=rss,"Sat, 01 Nov 2025 09:27:11 GMT",BBC,World
4daf3c713a5c67d8359a01ae286013d644751a562540b3f6bbe996632effe445,Watch: Train smashes into truck at Dutch level crossing,https://www.bbc.com/news/videos/ced65d0gl2eo?at_medium=RSS&at_campaign=rss,"Fri, 31 Oct 2025 13:37:10 GMT",BBC,World
31f18f570ecc981bc82eef45850591d86263ba6fcedef53d712b26d0d1f8dd17,'Everything's gone' - BBC finally able to access one of Jamaica's worst-hit areas,https://www.bbc.com/news/videos/c4gj9j66wxno?at_medium=RSS&at_campaign=rss,"Thu, 30 Oct 2025 18:39:57 GMT",BBC,World
a27751911ee23562e3b03ebfebe29621143e291e5adc63b0aedf75b526069461,"'Give your money away,' Billie Eilish tells billionaires",https://www.bbc.com/news/videos/cdx4qpdvjjko?at_medium=RSS&at_campaign=rss,"Fri, 31 Oct 2025 04:28:07 GMT",BBC,World
f1be3abca4edcaf0e0cc3b3df4c6915b4799c59a4f6f4d3b8fcd8510ee3e5fc7,Watch: US and China's different reports of their trade meeting,https://www.bbc.com/news/videos/cz0x8l52ey9o?at_medium=RSS&at_campaign=rss,"Thu, 30 Oct 2025 09:26:32 GMT",BBC,World
a1dc10720e10e52adbea3a503191fd1c954087ce239493d80bd39b62342e805a,Pornhub says UK visitors down 77% since age checks came in,https://www.bbc.com/news/articles/cgkz3m3re1zo?at_medium=RSS&at_campaign=rss,"Fri, 31 Oct 2025 00:43:42 GMT",BBC,Technology
5f5dec1caf1aa75bd49192b9ab45f73d6211b47f3b8caad193283fa6095dbc69,Security concerns over system at heart of digital ID,https://www.bbc.com/news/articles/c5y930x81wpo?at_medium=RSS&at_campaign=rss,"Fri, 31 Oct 2025 15:32:30 GMT",BBC,Technology
06bb418915c5db82dfac836f52d49d31e88e38f1adf728c21cd24ef30ec2ced6,Watchdog slams O2 over unexpected price rise,https://www.bbc.com/news/articles/cd047vl9ylpo?at_medium=RSS&at_campaign=rss,"Thu, 30 Oct 2025 15:22:09 GMT",BBC,Technology
a4ff5cd29cae9c0a3aa6ff330050eff1b40ccd0c6a1d4ed42dca1780c0d6ea99,First UK phones to get satellite connectivity in signal blackspots announced,https://www.bbc.com/news/articles/c993m88jer9o?at_medium=RSS&at_campaign=rss,"Thu, 30 Oct 2025 07:31:02 GMT",BBC,Technology
d1aa45b14fe808d24b67d8505d858c551bd04a8783e13067874872f4a97c2583,Websites disabled in Microsoft global outage come back online,https://www.bbc.com/news/articles/c3rj45n4x5eo?at_medium=RSS&at_campaign=rss,"Wed, 29 Oct 2025 22:44:07 GMT",BBC,Technology
22d80478f580fb5d25f567d556b0b41d80553770ff48eafa17b96ba0eec50572,Character.ai to ban teens from talking to its AI chatbots,https://www.bbc.com/news/articles/cq837y3v9y1o?at_medium=RSS&at_campaign=rss,"Wed, 29 Oct 2025 13:36:21 GMT",BBC,Technology
90e9d31614aaa95a9a371522d28bfcc9744b0ced1c1f494da57a6d926322ef07,"Amazon confirms 14,000 job losses in corporate division",https://www.bbc.com/news/articles/c1m3zm9jnl1o?at_medium=RSS&at_campaign=rss,"Tue, 28 Oct 2025 12:37:16 GMT",BBC,Technology
bc8439ab5277151e10f882af392061c845633053a2e3063f4f7b12312546b570,OpenAI completes shift to becoming for-profit,https://www.bbc.com/news/articles/cvgv38py7ewo?at_medium=RSS&at_campaign=rss,"Tue, 28 Oct 2025 19:36:59 GMT",BBC,Technology
b876ac7d2ef82d183ba8a7900d6613c7d62ad44bdf291a17e65a94570c3a36bf,Turing AI Institute boss denies accusations of 'toxic internal culture',https://www.bbc.com/news/articles/c9q1xdnydwjo?at_medium=RSS&at_campaign=rss,"Tue, 28 Oct 2025 00:04:41 GMT",BBC,Technology
812e5a3271197b4ff4599cb0880c45efbeaeef258ffaa1921facc35ab6d3f043,ChatGPT shares data on how many users exhibit psychosis or suicidal thoughts,https://www.bbc.com/news/articles/c5yd90g0q43o?at_medium=RSS&at_campaign=rss,"Mon, 27 Oct 2025 23:53:41 GMT",BBC,Technology
ea75af59f3a86752de61c5f15ff0b4725a7d1f8ee8bbad8847648ee186b222b9,Armed police handcuff teen after AI mistakes crisp packet for gun in US,https://www.bbc.com/news/articles/cgjdlx92lylo?at_medium=RSS&at_campaign=rss,"Fri, 24 Oct 2025 14:24:00 GMT",BBC,Technology
e1c7c61f3f56f48548ff8455d12110b0b6c282f091ff35b44de8e487039f1c76,"ChatGPT's new browser has potential, if you're willing to pay",https://www.bbc.com/news/articles/c20pdy1exxvo?at_medium=RSS&at_campaign=rss,"Sat, 25 Oct 2025 23:24:03 GMT",BBC,Technology
fe402db3908009b18943d54ad3b2ab4ac14828280459280cf35f39f3bee44b63,"Tech bosses could stop mobile phone theft, say MPs",https://www.bbc.com/news/articles/cx2y037pg41o?at_medium=RSS&at_campaign=rss,"Fri, 24 Oct 2025 13:14:09 GMT",BBC,Technology
91aa59a1724e5f267dd16dc75735c875ac6e13a12fb6c60f08e6300425e837c9,Millions of UK Apple users could get pay-out after court ruling,https://www.bbc.com/news/articles/cgkzg3mkgx6o?at_medium=RSS&at_campaign=rss,"Thu, 23 Oct 2025 18:08:48 GMT",BBC,Technology
5377aa1f6261d5793ff5ca7e2f1b936ce6873ae6b3bc6950ed4f61f5c03f9246,The striking Swedish workers taking on carmaker Tesla,https://www.bbc.com/news/articles/c5y9082q0jjo?at_medium=RSS&at_campaign=rss,"Sun, 26 Oct 2025 23:48:14 GMT",BBC,Technology
3fc09f44c5194c8bba194fb5b6b37397d769cd8e87b3df999af8254310570cae,JLR cyber-attack caused UK car production to hit 70-year low for September,https://www.bbc.com/news/articles/cvgmp1prnv0o?at_medium=RSS&at_campaign=rss,"Thu, 23 Oct 2025 23:01:48 GMT",BBC,Technology
2334144c9453cb21c8d385d8b54e023017b5016409b8a99ce87f05f70136abfe,"No digital ID checks until you change jobs, says No 10",https://www.bbc.com/news/articles/cy0kynek55wo?at_medium=RSS&at_campaign=rss,"Thu, 23 Oct 2025 17:00:49 GMT",BBC,Technology
e0eaa279eead14a760ef1a1cda276a5ee80eb31a7e5f34ae41f1228392399b22,Trump pardons Binance founder Changpeng Zhao,https://www.bbc.com/news/articles/cly1qrl9l1qo?at_medium=RSS&at_campaign=rss,"Thu, 23 Oct 2025 21:05:29 GMT",BBC,Technology
89fb4777b51978804764a6544018a54fe6fb38db55a20bc33ea89d6b169cedb0,Amazon apologises to customers impacted by huge AWS outage,https://www.bbc.com/news/articles/cvgvnp77dy9o?at_medium=RSS&at_campaign=rss,"Thu, 23 Oct 2025 12:08:51 GMT",BBC,Technology
7d437cfcbc2be78db47b53b73f93549ce1d73ec7039e6230fcc88c547bb99973,Amazon unveils prototype AI smart glasses for its delivery drivers,https://www.bbc.com/news/articles/c0rpzrrgqvlo?at_medium=RSS&at_campaign=rss,"Thu, 23 Oct 2025 03:18:34 GMT",BBC,Technology
014994071380a3ca856b507bba8a179f955e75e5e1ecce7e2d319bb76520f5ad,Tesla profits slide despite record revenue,https://www.bbc.com/news/articles/cql9yqxllqdo?at_medium=RSS&at_campaign=rss,"Thu, 23 Oct 2025 02:14:21 GMT",BBC,Technology
eb0fcc71a8c2a5c30362e010275cc88a5d4c460215a12ae59280c9bef0e5ef3c,Apple may be forced to allow rival app stores in UK,https://www.bbc.com/news/articles/c04gz1wx706o?at_medium=RSS&at_campaign=rss,"Wed, 22 Oct 2025 14:07:16 GMT",BBC,Technology
f02d2d008946a6532d63c1162749e485d26fef36c6d071df3410a2bd8810dec3,"JLR hack is costliest cyber attack in UK history, say analysts",https://www.bbc.com/news/articles/cy9pdld4y81o?at_medium=RSS&at_campaign=rss,"Wed, 22 Oct 2025 06:25:01 GMT",BBC,Technology
a750dc7311437e603eab41aecb5c4f83dd9ab0311b4055fc0f011f47498e0eb2,AWS outage: Are we relying too much on US big tech?,https://www.bbc.com/news/articles/c0jdgp6n45po?at_medium=RSS&at_campaign=rss,"Tue, 21 Oct 2025 19:14:08 GMT",BBC,Technology
2a48b8d8b31e81dec74e36be7a51d0b77ac4c04287c65535783a633a3633311f,Amazon outage 'resolved' as Snapchat and banks among sites impacted,https://www.bbc.com/news/articles/c20pgp3nx07o?at_medium=RSS&at_campaign=rss,"Tue, 21 Oct 2025 03:30:02 GMT",BBC,Technology
a8bc884b83f5845b3938aef1fcbdb05f904699c9509409529f148cd60296c253,Three wrongly accused over child abuse images after BT gets 'wires crossed',https://www.bbc.com/news/articles/ckgknm8xrgpo?at_medium=RSS&at_campaign=rss,"Tue, 21 Oct 2025 15:25:18 GMT",BBC,Technology
3f70977c3ae80c1782e88c0efac945bd62a26eb74eb079438b6bfb91eaf49f60,What caused the AWS outage - and why did it make the internet fall apart?,https://www.bbc.com/news/articles/cev1en9077ro?at_medium=RSS&at_campaign=rss,"Tue, 21 Oct 2025 08:29:43 GMT",BBC,Technology
90922f18a0d062385a92d2cbdcc7cf712b7cd9032c7b59015113830d58ebbd48,Spike in Disney+ cancellations after Kimmel suspension,https://www.bbc.com/news/articles/c1wle4dx4qwo?at_medium=RSS&at_campaign=rss,"Mon, 20 Oct 2025 21:11:50 GMT",BBC,Technology
47cfa3eadb618fd0ca8f0057b93ff8829c82ac2b5a965ce992dcb21e696ed8c8,Life-changing eye implant helps blind patients read again,https://www.bbc.com/news/articles/c0qpz39jpj7o?at_medium=RSS&at_campaign=rss,"Mon, 20 Oct 2025 12:00:12 GMT",BBC,Technology
785b48fb6e31b5a982e4a17888b68576715577f6846a44650d0ebf6aa86556b0,Bereaved families call for inquiry into government response to suicide websites,https://www.bbc.com/news/articles/c62e9v762pqo?at_medium=RSS&at_campaign=rss,"Mon, 20 Oct 2025 01:06:54 GMT",BBC,Technology
844c11187d252bbe3744d309bb212924393d0f6af1ec1ded722208765c1f197d,What's the best way to detect and destroy drones?,https://www.bbc.com/news/articles/cy40yjz10ydo?at_medium=RSS&at_campaign=rss,"Thu, 23 Oct 2025 08:53:05 GMT",BBC,Technology
2241a9e32a63bd89109b682acd185ccb96050e7290d17018c25db5a22d80d44e,Is Microsoft's first ever handheld Xbox console worth the wait?,https://www.bbc.com/news/articles/cqjwlnvx9jpo?at_medium=RSS&at_campaign=rss,"Wed, 15 Oct 2025 23:11:22 GMT",BBC,Technology
8ae1ebeec4e14bfa812d85ec0f33e0d3c7eae1ff4869cce7a147c31ce970c40a,The high tech studio transforming movie car stunts,https://www.bbc.com/news/videos/cy8vez7v95po?at_medium=RSS&at_campaign=rss,"Fri, 24 Oct 2025 14:25:32 GMT",BBC,Technology
f20838ab437d864529c8ca9e875edc4fa70a3438a775975e5dfd4b123961596e,Tech Life,https://www.bbc.co.uk/sounds/play/w3ct6zpd?at_medium=RSS&at_campaign=rss,"Tue, 14 Oct 2025 19:30:00 GMT",BBC,Technology
83a6a40e5b56ff8ebe6028cc845a68d05a82b48221b063f556304af28b57f9e8,Tech Now,https://www.bbc.co.uk/iplayer/episode/m002kxyy?at_medium=RSS&at_campaign=rss,"Sat, 11 Oct 2025 01:00:00 GMT",BBC,Technology
962afe64b81961fc165d693b3cf1e4e398ac4bb6d49c2c06a7651c253eee20f0,Tech Life,https://www.bbc.co.uk/sounds/play/w3ct6zpc?at_medium=RSS&at_campaign=rss,"Tue, 07 Oct 2025 19:30:00 GMT",BBC,Technology
6beea82a40a9f8bb4feefda8b3727d24e449099b2d896f17538feca6dd9267ff,Tech Life,https://www.bbc.co.uk/sounds/play/w3ct6zpb?at_medium=RSS&at_campaign=rss,"Tue, 30 Sep 2025 19:30:00 GMT",BBC,Technology
a90c358ac3bf828ad315a6200d666db07d08be362ad32221334099f9c42b6181,Tech Now,https://www.bbc.co.uk/iplayer/episode/m002k9fk?at_medium=RSS&at_campaign=rss,"Sat, 27 Sep 2025 01:00:17 GMT",BBC,Technology
5ea28a8399ca8566eca510208e5a71954f3c0dba44741639ed7394fa6471b654,Tech Life,https://www.bbc.co.uk/sounds/play/w3ct6zp9?at_medium=RSS&at_campaign=rss,"Tue, 23 Sep 2025 19:30:00 GMT",BBC,Technology
eca068f033262c2e1a553b73c2a61cc8289325d1dbea6ebeaa4febbce5fe94ac,Tech Now,https://www.bbc.co.uk/iplayer/episode/m002jzb7?at_medium=RSS&at_campaign=rss,"Sat, 20 Sep 2025 01:00:00 GMT",BBC,Technology
bc03313bbcff2ee7a59e21e2da2d3465404f7dfaa25b43c401a291ca29f5c241,Tech Now,https://www.bbc.co.uk/iplayer/episode/m002jnl0?at_medium=RSS&at_campaign=rss,"Sat, 13 Sep 2025 01:00:00 GMT",BBC,Technology
8d0babc075a8759a15fbd2dce3fb601c43001ced5a0476de5a32aee2da321ee4,Tech Life,https://www.bbc.co.uk/sounds/play/w3ct6zp7?at_medium=RSS&at_campaign=rss,"Tue, 09 Sep 2025 19:30:00 GMT",BBC,Technology
8037677f114eb5729aa5a9b86d78e29bec69913786c12577238f9efc226bf59c,Tech Now,https://www.bbc.co.uk/iplayer/episode/m002jb6f?at_medium=RSS&at_campaign=rss,"Sat, 06 Sep 2025 01:00:00 GMT",BBC,Technology
82e3bf43d1e7f81c8cf6be6aeec311823ce39c2ea664a46d291b1e2f4a1ad513,Tech Life,https://www.bbc.co.uk/sounds/play/w3ct6zp6?at_medium=RSS&at_campaign=rss,"Tue, 02 Sep 2025 19:30:00 GMT",BBC,Technology
7102b79db5920b52a234782a4590e0d7671d86572b45c2cbbd722baac07f2c6d,Tech Life,https://www.bbc.co.uk/sounds/play/w3ct6zp5?at_medium=RSS&at_campaign=rss,"Tue, 26 Aug 2025 19:30:00 GMT",BBC,Technology
edc63b767ec995f9759783cd68bde5992499f4889b5c6d5eb1564f22d7797a24,Tech Life,https://www.bbc.co.uk/sounds/play/w3ct6zp4?at_medium=RSS&at_campaign=rss,"Tue, 19 Aug 2025 19:30:00 GMT",BBC,Technology
099336edbdb78b11b2a2c70c87e776fbed744b80b1552c3bfbafacc00f5355d3,Tech Life,https://www.bbc.co.uk/sounds/play/w3ct6zp3?at_medium=RSS&at_campaign=rss,"Tue, 12 Aug 2025 19:37:00 GMT",BBC,Technology
61b07a84145bf83474067cf99484ca0231ece3b48e7f9eedb4a1a6c4c9dacf7c,The history behind the QR code,https://www.bbc.com/news/videos/c1jnpkdjjryo?at_medium=RSS&at_campaign=rss,"Tue, 05 Aug 2025 08:24:56 GMT",BBC,Technology
6f1f3ab57af83116a2a8c6d289834af8755fcd227767cb7996e389b7d4ca32ce,Tech Life,https://www.bbc.co.uk/sounds/play/w3ct6zp2?at_medium=RSS&at_campaign=rss,"Tue, 05 Aug 2025 19:30:00 GMT",BBC,Technology
198e5af74e6c150a2fee4e7d9771627f7d6285d3dd977d0a6111c4b2762ecc03,Tech Now,https://www.bbc.co.uk/iplayer/episode/m002gw67?at_medium=RSS&at_campaign=rss,"Sat, 02 Aug 2025 01:00:00 GMT",BBC,Technology
0c8adfae8d97a61cbf3455bbadeddf69685dbff6f8e9c6711699e03f07ded354,'This is the big one' - tech firms bet on electrifying rail,https://www.bbc.com/news/articles/czdjg92y00no?at_medium=RSS&at_campaign=rss,"Fri, 31 Oct 2025 00:14:09 GMT",BBC,Technology
a1c49ad879f779156aacafdf118885daa9314684ae84ca73791cf2c84e465ecf,The South African start-up bringing tech to townships,https://www.bbc.com/news/videos/c2310jkr9y9o?at_medium=RSS&at_campaign=rss,"Tue, 28 Oct 2025 00:07:11 GMT",BBC,Technology
a376d10da6210a517871c2b409efb83a651d415c6550e09321d7c2dd4973daa4,Can the plastic recycling industry be saved?,https://www.bbc.com/news/articles/c5yv8e0prg9o?at_medium=RSS&at_campaign=rss,"Thu, 23 Oct 2025 23:03:07 GMT",BBC,Technology
7dd54c98a8272ebf1b4f1d0d4cd84f793ae892076feee88872cd0d1e5cb9b54f,How good is the battery in a used electric vehicle?,https://www.bbc.com/news/articles/c2dn5gxxgz1o?at_medium=RSS&at_campaign=rss,"Thu, 16 Oct 2025 23:06:33 GMT",BBC,Technology
63f140710b0cb6bb9d5cf76f8ac5368e1fb3b67332e5a50a1cc0951674ab7c31,Why AI is being trained in rural India,https://www.bbc.com/news/articles/cqjevxvxw9xo?at_medium=RSS&at_campaign=rss,"Thu, 16 Oct 2025 11:22:10 GMT",BBC,Technology
9eb2fac32f0108551a59a2ca5ac8edf569b976e4524f03ac46b33ef0e57f0061,Food firms scramble to meet the high-protein craze,https://www.bbc.com/news/articles/c20zk35ypxno?at_medium=RSS&at_campaign=rss,"Mon, 06 Oct 2025 23:01:43 GMT",BBC,Technology
4b91dfc3d5f53b6152577d6267a67ac48bf2e98142285c2068055dfd35552892,The people turning to AI for dating and relationship advice,https://www.bbc.com/news/articles/c0kn4e377e2o?at_medium=RSS&at_campaign=rss,"Thu, 02 Oct 2025 23:01:20 GMT",BBC,Technology
2eea7cd16cd3eb990a7c24c12fed7da74b65d5382a9f9a8972c3dd11b78b2867,The bacteria turning waste plastic into painkillers,https://www.bbc.com/news/articles/c4gvm1kjxxvo?at_medium=RSS&at_campaign=rss,"Thu, 25 Sep 2025 23:02:06 GMT",BBC,Technology
9b8efb6d486c6b657076aa4d9886bf248a3bcff5bd377db6eb5b64e9279dd765,What's the big deal about AI data centres?,https://www.bbc.com/news/articles/ckg2ldpl9leo?at_medium=RSS&at_campaign=rss,"Mon, 22 Sep 2025 23:10:50 GMT",BBC,Technology
717aefcc24d0cffb8d2e708416fdc70eb92cefd5ba9ce88dfe3f44986e0b9d33,"We have hybrid cars, now hybrid planes are coming",https://www.bbc.com/news/articles/cx27vlp3zzgo?at_medium=RSS&at_campaign=rss,"Thu, 18 Sep 2025 23:01:17 GMT",BBC,Technology
485074bad03efa6303f21c25fa797374df9426683149d1aa49ef004555b44497,AI challenges the dominance of Google search,https://www.bbc.com/news/articles/c1dx9qy1eeno?at_medium=RSS&at_campaign=rss,"Mon, 15 Sep 2025 23:03:20 GMT",BBC,Technology
5ffdb7eb3fac4a0529604088e5f2e6abe9932f325d2a3e5b40ee65365ede2b2e,Publishers fear AI summaries are hitting online traffic,https://www.bbc.com/news/articles/c0mlvryx0exo?at_medium=RSS&at_campaign=rss,"Mon, 08 Sep 2025 23:07:35 GMT",BBC,Technology
bdf7607d3592213e44606ea8588915331a3856c971c8ad791c37bf3b99a1d5fa,The green steel firms looking to revive US steelmaking,https://www.bbc.com/news/articles/czer07x9zp2o?at_medium=RSS&at_campaign=rss,"Thu, 04 Sep 2025 23:01:17 GMT",BBC,Technology
6443ef10b7a36ae3e944345a259fffa2172f89bc7913456e67f198b9c6a8fa78,Computer science graduates struggle to secure their first jobs,https://www.bbc.com/news/articles/cm21dvg8l1go?at_medium=RSS&at_campaign=rss,"Thu, 21 Aug 2025 23:50:34 GMT",BBC,Technology
3bb0cc87914602afc65e75cd0de65e6bea2f3c4995d097fdd9e6f0fb57850667,How to destroy harmful 'forever chemicals',https://www.bbc.com/news/articles/clydd630pxzo?at_medium=RSS&at_campaign=rss,"Mon, 18 Aug 2025 23:22:14 GMT",BBC,Technology
a6a789ff5bedc5ea9a1249f4a6dc97950bd94b4d9e3d7e31b65795e6c67ece86,Will AI make language dubbing easy for film and TV?,https://www.bbc.com/news/articles/c36xy6r91kwo?at_medium=RSS&at_campaign=rss,"Thu, 14 Aug 2025 23:01:41 GMT",BBC,Technology
0448a02fb23f3f541fbefd65a5107931ed1e168c429e36b46a30a178332edcb0,Economic woes dominate as Bolivia prepares to go to the polls,https://www.bbc.com/news/articles/c62nn665g32o?at_medium=RSS&at_campaign=rss,"Wed, 13 Aug 2025 23:29:33 GMT",BBC,Technology
168e679a412ab99394ceae6646f04188bfae78e1b09e4deb8119c7fe9ecb2236,How to get AI to work in 22 languages,https://www.bbc.com/news/articles/cn0qqzz1e4zo?at_medium=RSS&at_campaign=rss,"Mon, 11 Aug 2025 23:01:09 GMT",BBC,Technology
34d365e057ee667f8de31d05342015c52c8b88d9874614f41c2d5b0c0627c5f0,Could aluminium become the packaging 'champion'?,https://www.bbc.com/news/articles/ce3nw5vnzgpo?at_medium=RSS&at_campaign=rss,"Mon, 28 Jul 2025 23:04:41 GMT",BBC,Technology
f0cf0855a1a0e0e9172ffbdcf81146973593681e4fe3cbc4e368a732deca1def,"Artificial food colours are out, so what's next?",https://www.bbc.com/news/articles/c4g83dpeendo?at_medium=RSS&at_campaign=rss,"Thu, 24 Jul 2025 23:01:09 GMT",BBC,Technology
e52cd6a6fc60b93b5e1da989a5b1ea5662adf64429e4cd567d51053af8cf521f,Post Office justice measures could include special stamp for victims,https://www.bbc.com/news/articles/cze6w4e8kxeo?at_medium=RSS&at_campaign=rss,"Fri, 31 Oct 2025 14:56:01 GMT",BBC,Business
54ab902fe711d501750dff17ac5c8b5e3db190672fe5ad07b3679894ed6db330,Disney pulls channels from YouTube TV over fee dispute,https://www.bbc.com/news/articles/c2emmdx0x38o?at_medium=RSS&at_campaign=rss,"Fri, 31 Oct 2025 16:43:55 GMT",BBC,Business
